{"id": "fixture_hybrid", "topology": "hybrid", "agents": [{"id": "a0", "role": "orchestrator", "model": "gpt-4o", "system_prompt": "You orchestrate a hybrid workflow. First delegate parallel research to specialists, then synthesize results.", "tools": [], "temperature": 0.2}, {"id": "a1", "role": "researcher_a", "model": "gpt-4o-mini", "system_prompt": "You research factual and technical information on the given topic.", "tools": ["web_search"], "temperature": 0.3}, {"id": "a2", "role": "researcher_b", "model": "gpt-4o-mini", "system_prompt": "You research market and business context on the given topic.", "tools": [], "temperature": 0.4}, {"id": "a3", "role": "synthesizer", "model": "gpt-4o", "system_prompt": "You synthesize all gathered research into a final comprehensive answer.", "tools": [], "temperature": 0.5}], "edges": [{"from": "a0", "to": "a1", "type": "broadcast"}, {"from": "a0", "to": "a2", "type": "broadcast"}, {"from": "a1", "to": "a3", "type": "reduce"}, {"from": "a2", "to": "a3", "type": "reduce"}], "topology_params": {"orchestrator_id": "a0", "reducer_id": "a3"}}
