{"id": "fixture_debate", "topology": "debate", "agents": [{"id": "a0", "role": "advocate", "model": "gpt-4o-mini", "system_prompt": "You argue strongly in favor of the proposed solution. Provide clear reasoning and evidence.", "tools": [], "temperature": 0.8}, {"id": "a1", "role": "critic", "model": "gpt-4o-mini", "system_prompt": "You critically challenge the proposed solution. Identify weaknesses, risks, and alternatives.", "tools": [], "temperature": 0.8}, {"id": "a2", "role": "judge", "model": "gpt-4o", "system_prompt": "You synthesize the debate between advocate and critic. Produce a balanced final answer that incorporates the strongest points from both sides.", "tools": [], "temperature": 0.3}], "edges": [{"from": "a0", "to": "a2", "type": "sequential"}, {"from": "a1", "to": "a2", "type": "sequential"}], "topology_params": {"judge_id": "a2", "debate_rounds": 2}}
