{"id": "fixture_fixed_pipeline", "topology": "fixed_pipeline", "agents": [{"id": "a0", "role": "researcher", "model": "gpt-4o-mini", "system_prompt": "You research and gather relevant information on the given topic. Be thorough and factual.", "tools": ["web_search"], "temperature": 0.3}, {"id": "a1", "role": "writer", "model": "gpt-4o-mini", "system_prompt": "You write clear, concise summaries based on research provided to you. Focus on key insights.", "tools": [], "temperature": 0.7}], "edges": [{"from": "a0", "to": "a1", "type": "sequential"}], "topology_params": {}}
