{"id": "fixture_ai_orchestrated", "topology": "ai_orchestrated", "agents": [{"id": "a0", "role": "orchestrator", "model": "gpt-4o", "system_prompt": "You are an orchestrator. Given a task, decide which specialist agent to delegate to next. Return JSON: {\"next_agent\": \"<agent_id>\", \"instruction\": \"<what to do>\"}. When done, return {\"next_agent\": null, \"final_answer\": \"<answer>\"}.", "tools": [], "temperature": 0.2}, {"id": "a1", "role": "analyst", "model": "gpt-4o-mini", "system_prompt": "You analyze data and provide structured insights when given an analysis task.", "tools": [], "temperature": 0.4}, {"id": "a2", "role": "writer", "model": "gpt-4o-mini", "system_prompt": "You write polished prose output based on structured content given to you.", "tools": [], "temperature": 0.7}], "edges": [{"from": "a0", "to": "a1", "type": "conditional"}, {"from": "a0", "to": "a2", "type": "conditional"}], "topology_params": {"orchestrator_id": "a0", "max_rounds": 5}}
