{"id": "fixture_parallel_reduce", "topology": "parallel_reduce", "agents": [{"id": "a0", "role": "specialist_a", "model": "gpt-4o-mini", "system_prompt": "You handle the technical aspects of the given question. Be precise and detailed.", "tools": [], "temperature": 0.4}, {"id": "a1", "role": "specialist_b", "model": "gpt-4o-mini", "system_prompt": "You handle the business and strategic aspects of the given question. Focus on practical implications.", "tools": [], "temperature": 0.5}, {"id": "a2", "role": "reducer", "model": "gpt-4o", "system_prompt": "You receive multiple specialist responses and synthesize them into one coherent, comprehensive answer.", "tools": [], "temperature": 0.4}], "edges": [{"from": "a0", "to": "a2", "type": "reduce"}, {"from": "a1", "to": "a2", "type": "reduce"}], "topology_params": {"reducer_id": "a2", "parallel_agent_ids": ["a0", "a1"]}}
