{"id": "fixture_human_in_loop", "topology": "human_in_loop", "agents": [{"id": "a0", "role": "drafter", "model": "gpt-4o-mini", "system_prompt": "You draft an initial response to the task. Clearly state your assumptions.", "tools": [], "temperature": 0.6}, {"id": "a1", "role": "refiner", "model": "gpt-4o-mini", "system_prompt": "You refine the draft based on human feedback provided. Incorporate feedback faithfully.", "tools": [], "temperature": 0.5}], "edges": [{"from": "a0", "to": "a1", "type": "sequential"}], "topology_params": {"human_pause_after": "a0", "human_prompt": "Review the draft above and provide feedback or approval."}}
